{
  "manifestVersion": 3,
  "id": "openpets.system-resources",
  "name": "$t:plugin.name",
  "description": "$t:plugin.description",
  "version": "2.0.0",
  "runtime": "javascript",
  "icon": "plugin",
  "sdkVersion": "3.0.0",
  "entry": "index.js",
  "assets": {
    "icons": {
      "system-resources": "assets/system-resources.svg",
      "cpu": "assets/cpu.svg",
      "ram": "assets/ram.svg",
      "gpu": "assets/gpu.svg",
      "disk": "assets/disk.svg"
    }
  },
  "permissions": [
    "pet:speak",
    "pet:reaction",
    "pet:pin",
    "schedule",
    "storage",
    "commands",
    "status",
    "system:metrics"
  ],
  "configSchema": {
    "showHud": {
      "type": "boolean",
      "default": true,
      "label": "$t:config.showHud.label",
      "description": "$t:config.showHud.description"
    },
    "pollSeconds": {
      "type": "number",
      "default": 10,
      "min": 5,
      "max": 60,
      "label": "$t:config.pollSeconds.label",
      "description": "$t:config.pollSeconds.description"
    },
    "alertPercent": {
      "type": "number",
      "default": 90,
      "min": 70,
      "max": 99,
      "label": "$t:config.alertPercent.label",
      "description": "$t:config.alertPercent.description"
    },
    "speakAlerts": {
      "type": "boolean",
      "default": true,
      "label": "$t:config.speakAlerts.label",
      "description": "$t:config.speakAlerts.description"
    }
  }
}
